{"schema":"codework_gpu_capability_report_v1","schema_version":1,"module_version":"0.6.0","platform":"test-platform","architecture":"test-arch","compiler":"test-compiler","vulkan":{"header_version":4202497,"requested_api_version":"1.2.0","loader_api_version":"1.3.0","negotiated_api_version":"1.2.0","portability_enumeration_available":true,"portability_enumeration_enabled":true},"validation":{"requested":true,"available":true,"enabled":true,"load_failed":false,"debug_utils_available":true,"warnings":1,"errors":0},"result":{"status":"ok","vulkan_result":0,"selected_device_index":0},"devices":[{"name":"Synthetic \"GPU\"","device_uuid":"000102030405060708090a0b0c0d0e0f","vendor_id":4660,"device_id":22136,"type":"integrated_gpu","api_version":"1.2.0","driver_version":42,"driver_name":"Synthetic Driver","driver_info":"1.2\\test","selected":true,"suitable":true,"rejection_bits":0,"rejections":[],"selected_queues":{"graphics":0,"compute":0,"transfer":0},"features":{"sampler_anisotropy":true,"shader_float64":false,"shader_int64":true,"portability_subset":true},"subgroup":{"size":32,"supported_stages":32,"supported_operations":31},"queue_families":[{"index":0,"queue_count":1,"flags":7,"timestamp_valid_bits":64,"min_image_transfer_granularity":[1,2,3],"graphics":true,"compute":true,"transfer":true,"sparse_binding":false,"protected":false}],"memory_heaps":[{"index":0,"size_bytes":8589934592,"flags":1,"device_local":true,"multi_instance":false}],"extensions":["VK_EXT_alpha","VK_KHR_portability_subset"]}]}
